{
  "id": "550e8400-e29b-41d4-a716-446655440000",
  "identity": "CRYPTO-002:rsa-2048:KeyEstablishmentLongLived",
  "ruleId": "CRYPTO-002",
  "algorithmId": "rsa-2048",
  "location": {
    "location": "src/main.go",
    "line": 42,
    "symbol": "rsa.GenerateKey"
  },
  "message": "RSA-2048 key generation found; vulnerable to Shor's algorithm.",
  "confidence": "LiteralArg",
  "usageContext": "KeyEstablishmentLongLived",
  "exposure": "PublicInternet",
  "shelfLifeBucket": "long",
  "hndlCritical": true,
  "provenance": "deterministic",
  "score": {
    "algorithmVulnerability": 40,
    "usageContext": 25,
    "dataShelfLife": 15,
    "exposure": 10,
    "detectionConfidence": 10,
    "total": 100,
    "severity": "Critical"
  }
}
